artists,name,id,popularity
"Richard Strauss, Jessye Norman, Gewandhausorchester, Kurt Masur","Vier letzte Lieder, TrV 296: 4. Im Abendrot",4LV6ml8J67CbLX979qwavF,31
The Chills,Pink Frost,70edK8hEu22TwodGaahjdO,47
The Cranberries,Uncertain - 'Uncertain' EP Version,5j76mavskCcMAy0HKxLROO,16
CCFX,The One to Wait,3MPFzBWdqwaAeCSQpA7Ift,4
"Montserrat Figueras, Hopkinson Smith, Giulio Caccini","Alme, luci beate",2iyobnahGscPhC7d8bIJcz,7
"Henry Purcell, Tragicomedia, Barbara Borden, Suzie LeBlanc, Erin Headley, Stephen Stubbs","Purcell: O dive custos Auriacae domus, Z. 504",0hH16TqHB95Rr71dSyDE7T,1
