artists,name,id,popularity
"Montserrat Figueras, Hopkinson Smith, Giulio Caccini","Alme, luci beate",2iyobnahGscPhC7d8bIJcz,7
"Henry Purcell, Nancy Argenta, Nigel North, Paul Nicholson, Richard Boothby","Purcell: ""O Solitude, My Sweetest Choice"", Z. 406",1Ip45TLLgMFZeQiWAYbNdP,33
"FranÁois Couperin, Pierre HantaÔ, Montserrat Figueras, Maria Cristina Kehr, Jordi Savall, Rolf Lislevand",Troisi√®me Le√ßon de T√©n√®bres √† 2 voix (Fran√ßois Couperin),4TVfhDmm2r6kVdrW23OZbk,30
"Henry Purcell, John Eliot Gardiner, Susan Graham, English Baroque Soloists","Purcell: Dido and Aeneas, Z. 626, Act III: Recitative. ""Thy Hand, Belinda"" - Song. ""When I Am Laid in Earth"" (Dido)",4L0zcjn7EdM4KVjI7znewu,2
"John Dowland, The Schoole of Night","Book of Songs, Book 2: Praise blindness, eyes, for seeing is deceit",0UclZT5eKLamWyp96Z3yvc,0
"Traditional, Jordi Savall, Montserrat Figueras, Maria Cristina Kiehr, Rolf Lislevand",Une jeune fillette (M√©lodie populaire - Arrangement Jordi Savall),0K1mYnV1naSrhB6AKRcz2s,31
"Bernard de Ventadorn, Millenarium",Ben m'an perdut,2jZj7LuTFq0HkddUdr8HQC,0
"Pierre de la Rue, Nancy Knowles, Live Oak",Trop plus secret,2F8wpr9u80nCtbyfjPVpY1,0
"John Dowland, Andreas Martin, Andreas Scholl","Flow, my tears",3Zxdi1d6sYDVmgOh1Ylblv,24
"Henry Purcell, Tragicomedia, Barbara Borden, Suzie LeBlanc, Erin Headley, Stephen Stubbs","Purcell: O dive custos Auriacae domus, Z. 504",0hH16TqHB95Rr71dSyDE7T,1
"Gilles Binchois, Ensemble Gilles Binchois, Dominique Vellard",Binchois: Triste plaisir et douleureuse joie,66RckhLAPf592kaRHC5cIg,18
"William Byrd, Stile Antico, Fretwork","Why do I use my paper, ink and pen?",3mAmSsXw7bf0juPB28A0tJ,15
"Heinrich Isaac, Live Oak",Mon pere m'a donne mari,4ntGepYqaGUw2ziQfr6My9,0
"Capella de Ministrers, Carles Magraner",Alta,1260rdnwjioc5zDJQocCDR,7
"Thomas Tomkins, Oxford Camerata, Laurence Cummings, Jeremy Summerly",When David heard that Absalom was slain,34IBnyA9QkuGSnf0oXZPGQ,2
The Clerks' Group,Missa Flos Regalis: Sanctus,5kVbrVYExiP809OFFyPVnL,0
The Clerks' Group,Missa Flos Regalis: Gloria,3uTKzqZ4EVdpu6INt6Uajg,0
"Gregorio Allegri, Oxford Camerata, Oxford Schola Cantorum, Jeremy Summerly",Il salmo Miserere mei Deus: Miserere,62VUI35qqDKicbURf7HNek,16
Dead Can Dance,The Song Of The Sibyl (Remastered),2KbTRhqw90FAVMkTG99qO1,0
"Johannes Cornago, Live Oak",Qu'es mi vida preguntays?,3cN7XEAwXA2fwpvPtKHrSA,0
"Traditional, Montserrat Figueras, Jordi Savall","Mareta no'm faces plorar (Mummy, don ºt make me cry)",3wbYiS7OS7hn8UvjxTodeL,17
